{
  "id": "TC-AUTH-008",
  "title": "Cambio de contraseña rechaza si la actual es incorrecta",
  "module": "auth.password",
  "type": "error",
  "priority": "medium",
  "estimated_minutes": 2,
  "preconditions": ["Sesión activa"],
  "steps": [
    {
      "step": 1,
      "action": "Abre el modal 'Cambiar contraseña' y llena la contraseña actual con un valor INCORRECTO",
      "expected": "El modal NO valida hasta que se intenta guardar",
      "evidence_hint": "none"
    },
    {
      "step": 2,
      "action": "Pulsa 'Guardar'",
      "expected": "Aparece error 'Usuario o contraseña incorrectos' (mensaje genérico) y la contraseña no cambia",
      "evidence_hint": "screenshot"
    },
    {
      "step": 3,
      "action": "Cierra sesión y vuelve a entrar con la contraseña original",
      "expected": "Login exitoso (la contraseña no se modificó)",
      "evidence_hint": "none"
    }
  ],
  "acceptance_criteria": [
    "El hash de contraseña en DB no se actualizó"
  ],
  "related_files": ["apps/desktop/src/components/change-password-dialog.tsx"],
  "tags": ["security"]
}
