{
  "id": "TC-AUTH-007",
  "title": "Cambio de contraseña propia desde el header",
  "module": "auth.password",
  "type": "happy_path",
  "priority": "high",
  "estimated_minutes": 4,
  "preconditions": ["Sesión activa con un usuario cualquiera"],
  "steps": [
    {
      "step": 1,
      "action": "Pulsa el ícono de llave en el header global",
      "expected": "Se abre el modal 'Cambiar contraseña' con campos: actual, nueva, confirmar",
      "evidence_hint": "screenshot"
    },
    {
      "step": 2,
      "action": "Llena todos los campos con datos válidos (nueva ≥8 chars, ambas iguales) y la actual correcta",
      "expected": "El botón 'Guardar' se habilita; al pulsarlo, el modal se cierra y aparece toast de éxito",
      "evidence_hint": "screenshot",
      "data": {
        "actual": "demo1234",
        "nueva": "demoNueva99",
        "confirmar": "demoNueva99"
      }
    },
    {
      "step": 3,
      "action": "Cierra sesión y vuelve a loguear con la contraseña NUEVA",
      "expected": "Login exitoso",
      "evidence_hint": "none"
    },
    {
      "step": 4,
      "action": "Cierra sesión y vuelve a intentar con la contraseña ANTERIOR",
      "expected": "Falla con 'Usuario o contraseña incorrectos'",
      "evidence_hint": "screenshot"
    }
  ],
  "acceptance_criteria": [
    "La contraseña anterior queda invalidada inmediatamente",
    "Las sesiones activas de otros dispositivos siguen funcionando (no se invalidan)"
  ],
  "related_files": [
    "apps/desktop/src/components/change-password-dialog.tsx",
    "packages/db/src/auth-flow.ts"
  ],
  "tags": ["security"]
}
